,created_time,message,success
177,2017-05-23 23:30:00,So machst Du Deutschland vom Sofa aus gerechter: In wenigen Schritten für eine faire Gesellschaft.,2190.0
222,2017-01-31 02:13:38,Es ist an der Zeit für die Werte unserer Gesellschaft auf- und zusammenzustehen.,954.0
178,2017-05-17 21:10:00,"Heute wird mal wieder über die Ehe für alle im Bundestag debattiert. Wir sagen: nicht länger reden, einfach machen! Lasst uns jetzt gemeinsam JA sagen und heute die 20.000 knacken.",592.0
158,2017-06-14 23:30:00,Löffelt was ihr wollt. Heiratet wen ihr wollt.  benjerry.de/aktuelle-initiativen/ehe-fuer-alle/messenger,574.0
156,2017-06-20 16:30:00,Jeder hat ein Recht auf ein Leben in Sicherheit. Darum machen wir uns für Menschen auf der Flucht stark und ihr könnt uns dabei unterstützen: http://www.benjerry.de/aktuelle-initi…/together-for-refugees #WorldRefugeeDay,567.0
