,created_time,message,success
817,2017-01-04 19:47:10,"Der Verfassungsschutz kannte den Berliner Terroristen Amri nicht nur, er half ihm mit einem V-Mann sogar fleißig im Vorfeld der Tat - zB beim Umzug von Dortmund nach Berlin: Die Kanzlerin möchte sich dazu nicht äußern, sondern erstmal die Untersuchungen abwarten. Das Bundesinnenministerium spielte heute dagegen das ""Mein Name ist Hase""-Spiel: ""Also so etwas ist mir nicht bekannt."" Ausschnitt aus der BPK vom 4. Januar 2017 - Komplett hier: https://youtu.be/qfjLQCL4Wxg Mehr daz...u im Bericht der tagesschau: https://www.tagesschau.de/inl…/anschlag-berlin-amri-101.html Videoquelle: ARD Brennpunkt vom 23. Dezember 2016 Bitte unterstützt unsere Arbeit finanziell: Tilo Jung IBAN: DE36700222000072410386  BIC: FDDODEMMXXX Verwendungszweck: BPK PayPal: www.paypal.me/JungNaiv (Wer mindestens €20 gibt, wird im darauffolgenden Monat in jeder Folge als Produzent gelistet) See more",9836.0
820,2017-01-02 23:22:20,"Noam Chomsky: Deutschland ist Teil einer Terrororganisation. Chomsky erklärt bei Jung & Naiv warum er das US-Drohnenprogramm als ""den mit Abstand größten terroristischen Feldzug der Welt"" bezeichnet. Tilo fragt, ob US-Präsident Obama damit ein Terrorist ist und ob die Bundesregierung, die durch Ramstein Teilnehmer dieses Drohnenkriegs ist, sich ebenfalls an Terrorismus beteiligt? ""Sicher! Und nicht nur das: Ihr seid Folterknechte"", sagt Chomsky.  Ausschnitt aus Jung & Naiv, F...olge 284 mit Noam Chomsky - Komplett hier: https://youtu.be/h0qdbsE3Jqo Leseversion (deutsch): http://www.jungundnaiv.de/…/noam-chomsky-die-ausserirdisch…/  Bitte unterstützt unsere Arbeit finanziell: Tilo Jung IBAN: DE36700222000072410386  BIC: FDDODEMMXXX Verwendungszweck: BPK PayPal: www.paypal.me/JungNaiv (Wer mindestens €20 gibt, wird im darauffolgenden Monat in jeder Folge als Produzent gelistet) See more",4382.0
819,2017-01-03 18:19:58,Heute gelernt: Angela Merkel hat ihre politische Karriere als eine Steffen Seibert begonnen! Sie wurde 1990 stellvertretende Regierungssprecherin der letzten DDR-Regierung. Wie sie sich dabei geschlagen hat? Seht selbst...,2975.0
814,2017-01-06 19:24:01,"Den ""starken Staat"" noch stärker machen: Was uns Innenminister de Maizière (CDU) diese Woche unbedingt vermitteln wollte (Mash Up) ...zum Schutz der Freiheit!",1664.0
813,2017-01-06 22:20:28,"""Fake News"" vom Entwicklungsminister? Gerd Müller (CSU) sprach heute davon, dass es ""Zehntausende Fälle"" von Sozialmissbrauch durch Asylbewerber geben würde. Interessante Zahlen, wenn sie denn stimmen würden. Nur konnte sein Ministerium heute überhaupt nicht erklären, wie der Entwicklungsminister auf diese Zahlen kommt... Vielleicht hat Müller die sich schlicht ausgedacht. Ausschnitt aus der BPK vom 6. Januar 2017 - Komplett hier: https://youtu.be/qfjLQCL4Wxg... Bericht von FAZ.NET - Frankfurter Allgemeine Zeitung http://bit.ly/2ikfblx Bitte unterstützt unsere Arbeit finanziell: Tilo Jung IBAN: DE36700222000072410386  BIC: FDDODEMMXXX Verwendungszweck: BPK PayPal: www.paypal.me/JungNaiv (Wer mindestens €20 gibt, wird im darauffolgenden Monat in jeder Folge als Produzent gelistet) See more",1147.0
